<?xml version="1.0" encoding="utf-8"?>
<!-- Created with Liquid Technologies Online Tools 1.0 (https://www.liquid-technologies.com) -->
<xs:schema xmlns:xsi="http://www.w3.org/2001/XMLSchema-instance" attributeFormDefault="unqualified" elementFormDefault="qualified" targetNamespace="DS_DELPPWConfiguration" xmlns:xs="http://www.w3.org/2001/XMLSchema">
  <xs:element name="DisplayNameAttributeList">
    <xs:complexType>
      <xs:sequence>
        <xs:element maxOccurs="unbounded" name="Type">
          <xs:complexType>
            <xs:sequence>
              <xs:element maxOccurs="unbounded" name="Attribute" minOccurs="1">
                <xs:complexType>
                  <xs:attribute name="name" type="xs:string" use="required" />
                  <xs:attribute name="dicoType" type="xs:string" use="optional" />
                </xs:complexType>
              </xs:element>
            </xs:sequence>
            <xs:attribute name="name" type="xs:string" use="required" />
            <xs:attribute name="separator" type="xs:string" use="optional" />
          </xs:complexType>
        </xs:element>
      </xs:sequence>
      <xs:attribute name="version" type="xs:decimal" use="required" />
      <xs:attribute name="Title" type="xs:string" use="required" />
      <xs:attribute name="Description" type="xs:string" use="required" />
    </xs:complexType>
  </xs:element>
</xs:schema>
